{
  "submissionId": "7e2f843e-d639-40b3-8611-8015f3a18958",
  "prosecutionCaseSubject": {
    "urn": "caseURN",
    "prosecutingAuthority": "The OU Code of the prosecuting authority"
  },
  "defendantOffencesSubjects": [
    {
      "defendant": {
        "prosecutorDefendantId": "defendant Id"
      },
      "principalCharges": "test"
    }
  ],
  "tag": "tag",
  "ptphAdvocate": {
    "email": "Email",
    "name": "name",
    "phone": "phone number"
  },
  "trialAdvocate": {
    "email": "Email",
    "name": "name",
    "phone": "phone number"
  },
  "reviewingLawyer": {
    "email": "Email",
    "name": "name",
    "phone": "phone number"
  },
  "prosecutionCaseProgressionOfficer": {
    "email": "Email",
    "name": "name",
    "phone": "phone number"
  },
  "officerInTheCase": {
    "email": "Email",
    "name": "name",
    "phone": "phone number"
  },
  "cpsOffice": "Cps Office",
  "draftIndictment": "Draft Indictment",
  "draftIndictmentNotes": "Draft Indictment Notes",
  "summaryOfCircumstances": "Summary Of Circumstances",
  "summaryOfCircumstancesNotes": "Summary Of Circumstances Notes",
  "statementsForPAndICm": "Statements For P And ICm",
  "statementsForPAndICmNotes": "Statements For P And ICm Notes",
  "exhibitsForPAndICm": "Exhibits For P And ICm",
  "exhibitsForPAndICmNotes": "Exhibits For P And ICm Notes",
  "cctv": "Cctv",
  "cctvNotes": "Cctv Notes",
  "streamlinedForensicReport": "Streamlined Forensic Report",
  "streamlinedForensicReportNotes": "Streamlined Forensic Report Notes",
  "medicalEvidence": "Medical Evidence",
  "medicalEvidenceNotes": "Medical Evidence Notes",
  "expertEvidence": "Expert Evidence",
  "badCharacter": "Bad Character",
  "badCharacterNotes": "Bad Character Notes",
  "hearsay": "Hear say",
  "hearsayNotes": "Hear say Notes",
  "specialMeasures": "Special Measures",
  "specialMeasuresNotes": "Special Measures Notes",
  "criminalRecord": "Criminal Record",
  "criminalRecordNotes": "Criminal Record Notes",
  "victimPersonalStatement": "Victim Personal Statement",
  "victimPersonalStatementNotes": "Victim Personal Statement Notes",
  "disclosureManagementDoc": "Disclosure Management Doc",
  "disclosureManagementDocNotes": "Disclosure Management Doc Notes",
  "thirdParty": "Third Party",
  "thirdPartyNotes": "Third Party Notes",
  "reviewDisclosableMaterial": "Review Disclosable Material",
  "reviewDisclosableMaterialNotes": "Review Disclosable Material Notes",
  "particularsOfAnyRelatedCriminalProceedings": "Particulars Of Any Related Criminal Proceedings",
  "particularsOfAnyFamily": "Particulars Of Any Family",
  "witnesses": [
    {
      "witnessFirstName": "forename",
      "witnessLastName": "abc",
      "relevantDisputedIssue": "Issue 1",
      "intermediaryForWitness": "Y",
      "firstNameOfIntermediaryKnownAtPtph": "first name",
      "lastNameOfIntermediaryKnownAtPtph": "last name",
      "policeOfficerSubject": {
        "officerInCharge": true,
        "officerRank": "Rank1"
      }
    }
  ]
}